{
  "best_condition_selected": false,
  "case_accounting": {
    "attempted_per_condition": 490,
    "completed_per_condition": 490,
    "failed_case_handling": "explicit_private_failure_rows_retained",
    "failed_per_condition": 0,
    "public_case_level_row_count": 0,
    "public_event_level_row_count": 0,
    "silent_exclusion_count": 0
  },
  "condition_order": [
    "P0S0",
    "P1S0",
    "P0S1",
    "P1S1"
  ],
  "conditions": [
    {
      "case_count": 490,
      "condition_id": "P0S0",
      "failed_case_count": 0,
      "final_model_sha256": "f783ba214b9dc7e511ff4af7d38a641bd3924861cf562fad670b4b840ff77f3f",
      "final_timestep": 1000000,
      "metrics": [
        {
          "maximum": 25.649368170912943,
          "mean": 12.781151655923699,
          "median": 12.60505671509436,
          "metric_name": "mean_absolute_bis_deviation",
          "minimum": 3.9586525080607244,
          "q1": 9.93068130995019,
          "q3": 15.385190377569023,
          "sd": 4.224781815367709,
          "subject_count": 483,
          "unit": "BIS points"
        },
        {
          "maximum": 27.939926385037978,
          "mean": 16.076604140950987,
          "median": 15.6065459195789,
          "metric_name": "root_mean_squared_bis_deviation",
          "minimum": 6.46032841362019,
          "q1": 13.173288527681741,
          "q3": 18.6022003051754,
          "sd": 4.134024394145802,
          "subject_count": 483,
          "unit": "BIS points"
        },
        {
          "maximum": 35020.0,
          "mean": 6888.778467908903,
          "median": 4890.0,
          "metric_name": "time_in_bis_40_60_seconds",
          "minimum": 0.0,
          "q1": 1950.0,
          "q3": 9890.0,
          "sd": 6316.292709157103,
          "subject_count": 483,
          "unit": "seconds"
        },
        {
          "maximum": 970.0,
          "mean": 2.070393374741201,
          "median": 0.0,
          "metric_name": "time_below_bis_40_seconds",
          "minimum": 0.0,
          "q1": 0.0,
          "q3": 0.0,
          "sd": 44.15480140114318,
          "subject_count": 483,
          "unit": "seconds"
        },
        {
          "maximum": 21630.0,
          "mean": 4674.989648033126,
          "median": 4050.0,
          "metric_name": "time_above_bis_60_seconds",
          "minimum": 710.0,
          "q1": 2845.0,
          "q3": 5710.0,
          "sd": 2785.54654490542,
          "subject_count": 483,
          "unit": "seconds"
        },
        {
          "maximum": 353361.0773447766,
          "mean": 131111.15363403613,
          "median": 123456.17659549235,
          "metric_name": "integrated_absolute_bis_error_bis_seconds",
          "minimum": 30046.56680990945,
          "q1": 93765.16079697097,
          "q3": 154214.48410737398,
          "sd": 53036.361093440355,
          "subject_count": 483,
          "unit": "BIS-point seconds"
        },
        {
          "maximum": 47.96752281071906,
          "mean": 47.95326892881818,
          "median": 47.95608966442603,
          "metric_name": "maximum_absolute_bis_deviation",
          "minimum": 47.28430278780769,
          "q1": 47.95262626299635,
          "q3": 47.95876875140848,
          "sd": 0.032772641283402175,
          "subject_count": 483,
          "unit": "BIS points"
        },
        {
          "maximum": 1715.7194043770432,
          "mean": 496.04654939503524,
          "median": 425.53477473556995,
          "metric_name": "cumulative_propofol_amount_mg",
          "minimum": 123.53305439651012,
          "q1": 280.75267224386334,
          "q3": 632.282284412533,
          "sd": 279.48465869487177,
          "subject_count": 483,
          "unit": "mg"
        },
        {
          "maximum": 2.7761739210631604,
          "mean": 2.5568054175606694,
          "median": 2.605627825749772,
          "metric_name": "mean_propofol_infusion_rate_mg_per_min",
          "minimum": 1.5987885454297066,
          "q1": 2.5047004003808713,
          "q3": 2.662554831516748,
          "sd": 0.1691116708861949,
          "subject_count": 483,
          "unit": "mg/min"
        },
        {
          "maximum": 0.020368369130477362,
          "mean": 0.004422599171615995,
          "median": 0.0038515764629245934,
          "metric_name": "action_change_magnitude_mg_per_min",
          "minimum": 0.0009120173403753979,
          "q1": 0.0026174067999161325,
          "q3": 0.005539363395988227,
          "sd": 0.002518321356246506,
          "subject_count": 483,
          "unit": "mg/min"
        },
        {
          "maximum": 1236.221243840836,
          "mean": 167.86275303133658,
          "median": 99.22614021005795,
          "metric_name": "cumulative_episode_reward",
          "minimum": 19.351620301373377,
          "q1": 55.16027108205492,
          "q3": 200.835906811418,
          "sd": 182.79252622843757,
          "subject_count": 483,
          "unit": "arbitrary reward units"
        }
      ],
      "seed": 42,
      "subject_count": 483
    },
    {
      "case_count": 490,
      "condition_id": "P1S0",
      "failed_case_count": 0,
      "final_model_sha256": "c73bd394af2e5bf801c890bf9d98e1bf5876660b775c3c611ab7c8cdf0a93b83",
      "final_timestep": 1000000,
      "metrics": [
        {
          "maximum": 19.22144234657893,
          "mean": 5.421165823239539,
          "median": 4.450716869466532,
          "metric_name": "mean_absolute_bis_deviation",
          "minimum": 0.9416067726415588,
          "q1": 2.8787432694967654,
          "q3": 6.757749600507022,
          "sd": 3.519590712463642,
          "subject_count": 483,
          "unit": "BIS points"
        },
        {
          "maximum": 29.400946459986553,
          "mean": 12.522641021723583,
          "median": 11.853032993366476,
          "metric_name": "root_mean_squared_bis_deviation",
          "minimum": 3.7127443144428467,
          "q1": 8.791881232587116,
          "q3": 15.300148264206747,
          "sd": 4.805072360025443,
          "subject_count": 483,
          "unit": "BIS points"
        },
        {
          "maximum": 37270.0,
          "mean": 10318.416149068324,
          "median": 8560.0,
          "metric_name": "time_in_bis_40_60_seconds",
          "minimum": 2480.0,
          "q1": 5575.0,
          "q3": 13385.0,
          "sd": 6186.118446852909,
          "subject_count": 483,
          "unit": "seconds"
        },
        {
          "maximum": 350.0,
          "mean": 1.7391304347826086,
          "median": 0.0,
          "metric_name": "time_below_bis_40_seconds",
          "minimum": 0.0,
          "q1": 0.0,
          "q3": 0.0,
          "sd": 20.9692093196489,
          "subject_count": 483,
          "unit": "seconds"
        },
        {
          "maximum": 7660.0,
          "mean": 1245.6832298136646,
          "median": 1010.0,
          "metric_name": "time_above_bis_60_seconds",
          "minimum": 150.0,
          "q1": 650.0,
          "q3": 1545.0,
          "sd": 990.2819546250132,
          "subject_count": 483,
          "unit": "seconds"
        },
        {
          "maximum": 252292.7172985599,
          "mean": 53264.720725274296,
          "median": 45447.32799446284,
          "metric_name": "integrated_absolute_bis_error_bis_seconds",
          "minimum": 9585.165822414816,
          "q1": 31565.082729211987,
          "q3": 68201.30639525804,
          "sd": 32202.589710174605,
          "subject_count": 483,
          "unit": "BIS-point seconds"
        },
        {
          "maximum": 48.0,
          "mean": 47.9552732334587,
          "median": 47.95932267943195,
          "metric_name": "maximum_absolute_bis_deviation",
          "minimum": 47.279417341770056,
          "q1": 47.94211246257658,
          "q3": 47.972462287918155,
          "sd": 0.038627747817754,
          "subject_count": 483,
          "unit": "BIS points"
        },
        {
          "maximum": 2394.340334638953,
          "mean": 781.4877896265244,
          "median": 693.1199783459306,
          "metric_name": "cumulative_propofol_amount_mg",
          "minimum": 199.21370063722134,
          "q1": 491.901412691921,
          "q3": 980.3075418248773,
          "sd": 388.9201201223261,
          "subject_count": 483,
          "unit": "mg"
        },
        {
          "maximum": 6.333257547555825,
          "mean": 4.219390657440774,
          "median": 4.217317730116729,
          "metric_name": "mean_propofol_infusion_rate_mg_per_min",
          "minimum": 1.317263327274896,
          "q1": 3.8178044473595856,
          "q3": 4.67191363858495,
          "sd": 0.7078065041983257,
          "subject_count": 483,
          "unit": "mg/min"
        },
        {
          "maximum": 0.7204311109464103,
          "mean": 0.24085650824755986,
          "median": 0.2162600747497407,
          "metric_name": "action_change_magnitude_mg_per_min",
          "minimum": 0.037838550985221965,
          "q1": 0.1552581233570179,
          "q3": 0.30136174722881226,
          "sd": 0.1183512972153756,
          "subject_count": 483,
          "unit": "mg/min"
        },
        {
          "maximum": 3042.9770204625147,
          "mean": 648.1427441800761,
          "median": 531.6675231498139,
          "metric_name": "cumulative_episode_reward",
          "minimum": 99.75439359892377,
          "q1": 319.0372068310914,
          "q3": 843.1297268208293,
          "sd": 440.10253194896825,
          "subject_count": 483,
          "unit": "arbitrary reward units"
        }
      ],
      "seed": 42,
      "subject_count": 483
    },
    {
      "case_count": 490,
      "condition_id": "P0S1",
      "failed_case_count": 0,
      "final_model_sha256": "644371f5d74164fbe04b5f85f2301c4e2b0babf193e1667e623d3a209ce67947",
      "final_timestep": 1000000,
      "metrics": [
        {
          "maximum": 17.161176664215855,
          "mean": 7.67335913602393,
          "median": 7.416988059793231,